{
  "schemaVersion": "golden-path-rule-catalog/v1",
  "contractVersion": "golden-path/v1",
  "standardVersion": "2026.07",
  "rules": [
    {
      "id": "DT-META-001",
      "title": "Applicable repositories declare Golden Path metadata",
      "level": "MUST",
      "source": {
        "decision": "GP-010",
        "document": "README.md",
        "anchor": "repository-local-contract"
      },
      "applicability": {
        "profiles": ["*"],
        "artifactTypes": [],
        "capabilities": [],
        "condition": "The repository is active, buildable, and organization-managed."
      },
      "assessment": "automated",
      "severity": "error",
      "waivable": true,
      "highRisk": false,
      "assertion": "The repository contains schema-valid .github/golden-path.yaml metadata with explicit profile, artifact, capability, contract, standard, and asset bundle versions.",
      "remediation": "Create or update repository-local metadata from the versioned schema and declare only applicable profiles and capabilities.",
      "introducedIn": "2026.07",
      "retiredIn": null,
      "replacement": null
    },
    {
      "id": "DT-META-002",
      "title": "Declared applicability matches repository evidence",
      "level": "MUST",
      "source": {
        "decision": "GP-010",
        "document": "conformance.md",
        "anchor": "inputs"
      },
      "applicability": {
        "profiles": ["*"],
        "artifactTypes": [],
        "capabilities": [],
        "condition": "Golden Path metadata is present."
      },
      "assessment": "hybrid",
      "severity": "error",
      "waivable": true,
      "highRisk": false,
      "assertion": "Declared profiles, artifact types, capabilities, and not-applicable status agree with native manifests, toolchain files, commands, and generated-only or archived evidence.",
      "remediation": "Correct stale metadata or migrate the executable repository surface; do not add successful no-op commands to simulate applicability.",
      "introducedIn": "2026.07",
      "retiredIn": null,
      "replacement": null
    },
    {
      "id": "DT-CMD-001",
      "title": "Applicable repositories expose a root Just façade",
      "level": "MUST",
      "source": {
        "decision": "GP-006",
        "document": "command-contract.md",
        "anchor": "base-commands"
      },
      "applicability": {
        "profiles": ["*"],
        "artifactTypes": [],
        "capabilities": [],
        "condition": "The repository is active and buildable."
      },
      "assessment": "automated",
      "severity": "error",
      "waivable": true,
      "highRisk": false,
      "assertion": "The repository root contains a Just-supported root file exposing init, check, and ci as the stable human and automation entry points.",
      "remediation": "Add a root justfile and implement the base commands using native profile commands.",
      "introducedIn": "2026.07",
      "retiredIn": null,
      "replacement": null
    },
    {
      "id": "DT-CMD-002",
      "title": "Base commands are truthful and non-placeholder",
      "level": "MUST_NOT",
      "source": {
        "decision": "GP-006",
        "document": "command-contract.md",
        "anchor": "command-behavior"
      },
      "applicability": {
        "profiles": ["*"],
        "artifactTypes": [],
        "capabilities": [],
        "condition": "A base command or declared capability is evaluated."
      },
      "assessment": "hybrid",
      "severity": "error",
      "waivable": true,
      "highRisk": false,
      "assertion": "Base and capability commands do not succeed through a no-op, placeholder, swallowed failure, or unrelated check.",
      "remediation": "Implement the real validation, remove the inapplicable capability declaration, or record an approved time-bounded exception.",
      "introducedIn": "2026.07",
      "retiredIn": null,
      "replacement": null
    },
    {
      "id": "DT-CMD-003",
      "title": "CI is deterministic and non-mutating",
      "level": "MUST",
      "source": {
        "decision": "GP-006",
        "document": "command-contract.md",
        "anchor": "check-and-ci"
      },
      "applicability": {
        "profiles": ["*"],
        "artifactTypes": [],
        "capabilities": [],
        "condition": "The ci command is run in a clean checkout with declared prerequisites."
      },
      "assessment": "hybrid",
      "severity": "error",
      "waivable": true,
      "highRisk": false,
      "assertion": "The ci command composes required repository checks, fails closed, avoids shared-state mutation, and does not depend on undeclared interactive or developer-local state; quality CI and deployment orchestration keep independently reviewable permission, credential, and mutation boundaries.",
      "remediation": "Move deployment and repair operations out of ci, establish explicit quality-versus-deployment boundaries, declare prerequisites, and make the command fail when a required check fails.",
      "introducedIn": "2026.07",
      "retiredIn": null,
      "replacement": null
    },
    {
      "id": "DT-CMD-004",
      "title": "Just composition remains modular and discoverable",
      "level": "SHOULD",
      "source": {
        "decision": "GP-006",
        "document": "task-runner.md",
        "anchor": "root-responsibility"
      },
      "applicability": {
        "profiles": ["*"],
        "artifactTypes": [],
        "capabilities": [],
        "condition": "The Justfile contains more than a small direct façade."
      },
      "assessment": "manual",
      "severity": "warning",
      "waivable": false,
      "highRisk": false,
      "assertion": "The root Justfile stays thin and delegates cohesive implementation to flat imports, namespaced modules, or repository-local scripts.",
      "remediation": "Extract cohesive recipes into imported modules or scripts while retaining stable root commands.",
      "introducedIn": "2026.07",
      "retiredIn": null,
      "replacement": null
    },
    {
      "id": "DT-CMD-005",
      "title": "Required caller workflows execute the repository CI contract",
      "level": "MUST",
      "source": {
        "decision": "GP-006",
        "document": "command-contract.md",
        "anchor": "check-and-ci"
      },
      "applicability": {
        "profiles": ["*"],
        "artifactTypes": [],
        "capabilities": [],
        "condition": "A required CI caller workflow validates the repository."
      },
      "assessment": "hybrid",
      "severity": "error",
      "waivable": true,
      "highRisk": false,
      "assertion": "The caller invokes root just ci or the exact same repository-owned implementation path without reimplementing the quality graph.",
      "remediation": "Make the workflow prepare the declared environment and call just ci; remove duplicated or unrelated quality orchestration.",
      "introducedIn": "2026.07",
      "retiredIn": null,
      "replacement": null
    },
    {
      "id": "DT-TOOL-001",
      "title": "Every runtime has one operational version owner",
      "level": "MUST",
      "source": {
        "decision": "GP-007",
        "document": "toolchain-management.md",
        "anchor": "operational-owners"
      },
      "applicability": {
        "profiles": ["*"],
        "artifactTypes": [],
        "capabilities": [],
        "condition": "The repository uses a language runtime or IaC CLI."
      },
      "assessment": "hybrid",
      "severity": "error",
      "waivable": true,
      "highRisk": false,
      "assertion": "Each toolchain has one declared operational owner: mise for Node.js, Go, Zig and generic CLIs, uv for Python, or rustup for Rust.",
      "remediation": "Select the profile owner and remove competing installers or selectors for the same toolchain.",
      "introducedIn": "2026.07",
      "retiredIn": null,
      "replacement": null
    },
    {
      "id": "DT-TOOL-002",
      "title": "Runtime and tool selectors are exact and committed",
      "level": "MUST",
      "source": {
        "decision": "GP-007",
        "document": "toolchain-management.md",
        "anchor": "common-contract"
      },
      "applicability": {
        "profiles": ["*"],
        "artifactTypes": [],
        "capabilities": [],
        "condition": "A runtime or repository tool is required to build, validate, package, or release."
      },
      "assessment": "automated",
      "severity": "error",
      "waivable": true,
      "highRisk": false,
      "assertion": "Committed toolchain configuration resolves exact supported versions and does not use latest, stable, master, nightly, or an unbounded range.",
      "remediation": "Pin the runtime and required tools to an exact supported version in the profile owner file.",
      "introducedIn": "2026.07",
      "retiredIn": null,
      "replacement": null
    },
    {
      "id": "DT-TOOL-003",
      "title": "Mise-managed tools use a committed lock",
      "level": "MUST",
      "source": {
        "decision": "GP-007",
        "document": "toolchain-management.md",
        "anchor": "common-contract"
      },
      "applicability": {
        "profiles": ["*"],
        "artifactTypes": [],
        "capabilities": [],
        "condition": "mise manages one or more repository tool versions."
      },
      "assessment": "automated",
      "severity": "error",
      "waivable": true,
      "highRisk": false,
      "assertion": "The repository commits mise.toml and mise.lock with a minimum mise compatibility requirement.",
      "remediation": "Resolve exact tool versions with the supported mise line, commit the lock, and validate it in CI.",
      "introducedIn": "2026.07",
      "retiredIn": null,
      "replacement": null
    },
    {
      "id": "DT-TOOL-004",
      "title": "Bootstrap and CI use the same declared toolchain",
      "level": "MUST",
      "source": {
        "decision": "GP-007",
        "document": "toolchain-management.md",